{
  "$schema": "http://json-schema.org/draft-07/schema#",
  "$id": "mpango/harness-governance/protocol-deltas.schema.json",
  "title": "Mpango ERP inventory protocol deltas",
  "description": "Reviewed, owned, single-use authorizations for changes to frozen inventory identity and to the governance core. Anti-replay: a delta only authorizes the comparison whose base_sha it carries; historical deltas (byte-identical to the baseline copy) cannot be reused. Kind-precise: removal/rename/reorder/reclassify authorize node identity and status changes by affected_ids; governance authorizes governance-core path changes by affected_paths (renames list both the previous and the new id in affected_ids).",
  "type": "array",
  "items": {
    "type": "object",
    "additionalProperties": false,
    "required": [
      "delta_id",
      "kind",
      "affected_ids",
      "affected_paths",
      "base_sha",
      "owner",
      "reason",
      "approval_ref"
    ],
    "properties": {
      "delta_id": { "type": "string", "pattern": "^PD-[A-Z0-9]+(-[A-Z0-9]+)*$", "minLength": 4 },
      "kind": { "enum": ["removal", "rename", "reorder", "reclassify", "governance"] },
      "affected_ids": {
        "type": "array",
        "uniqueItems": true,
        "items": { "type": "string", "minLength": 1 },
        "description": "node or debt ids this delta authorizes; governance deltas may leave it empty"
      },
      "affected_paths": {
        "type": "array",
        "uniqueItems": true,
        "items": { "type": "string", "minLength": 2 },
        "description": "repository paths this delta covers (prefix match); required non-empty for kind=governance"
      },
      "base_sha": {
        "type": "string",
        "pattern": "^[0-9a-f]{40}$",
        "description": "the comparison base commit this delta authorizes; must equal the validator's actual comparison base"
      },
      "owner": { "type": "string", "minLength": 1 },
      "reason": { "type": "string", "minLength": 1 },
      "approval_ref": { "type": "string", "minLength": 1 },
      "date": { "type": "string", "pattern": "^[0-9]{4}-[0-9]{2}-[0-9]{2}$" },
      "notes": { "type": "string" }
    }
  }
}
