[
 {
  "delta_id": "PD-2026-08-25-HE2-R1-GOV",
  "kind": "governance",
  "affected_ids": [],
  "affected_paths": [
   ".github/workflows/harness-governance-gate.yml",
   "harness-governance/governed-paths.json",
   "harness-governance/validator/",
   "harness-governance/schemas/",
   "harness-governance/tests/"
  ],
  "base_sha": "94b0c30034d04d1bad87f926a4b09e3dbbe3c6db",
  "owner": "cto",
  "reason": "DC-12R1-MVP-L1-HE2-R1 bypass closure: harden the governance core itself (fail-closed schemas, semantic sync, waiver scoping, evidence binding, delta anti-replay, structural/release gate split)",
  "approval_ref": "DC-12R1-MVP-L1-HE2-R1",
  "date": "2026-08-25"
 },
 {
  "delta_id": "PD-2026-08-25-HE2-R2-HOP",
  "kind": "governance",
  "affected_ids": [],
  "affected_paths": [
   ".github/workflows/harness-governance-gate.yml",
   ".secrets.baseline",
   "harness-governance/validator/",
   "harness-governance/tests/"
  ],
  "base_sha": "5a380586caab4f662d7e1dfbc7899cf5bd3bc300",
  "owner": "cto",
  "reason": "DC-12R1-MVP-L1-HE2-R2 evidence raw-blob integrity + scanner scope closure: raw-byte _git_raw, anchored scanner rule, .secrets.baseline in PROTECTED_PATHS, PR baseline pinning",
  "approval_ref": "DC-12R1-MVP-L1-HE2-R2",
  "date": "2026-08-25"
 },
 {
  "delta_id": "PD-2026-08-25-HE2-CUMULATIVE",
  "kind": "governance",
  "affected_ids": [],
  "affected_paths": [
   ".github/workflows/harness-governance-gate.yml",
   ".secrets.baseline",
   "harness-governance/governed-paths.json",
   "harness-governance/validator/",
   "harness-governance/schemas/",
   "harness-governance/tests/"
  ],
  "base_sha": "94b0c30034d04d1bad87f926a4b09e3dbbe3c6db",
  "owner": "cto",
  "reason": "DC-12R1-MVP-L1-HE2-R3 cumulative review governance delta: authorizes all governance-core path changes from HE2_PARENT (94b0c300) through R1, R2, and R3",
  "approval_ref": "DC-12R1-MVP-L1-HE2-R3",
  "date": "2026-08-25"
 },
 {
  "delta_id": "PD-2026-08-25-HE2-R3-R1-ALL-FILE-SCOPE",
  "kind": "governance",
  "affected_ids": [],
  "affected_paths": [
   "harness-governance/validator/",
   "harness-governance/tests/"
  ],
  "base_sha": "d7ea8027bf7d4ba5ec0a8d2f92965e5061680f34",
  "owner": "cto",
  "reason": "DC-12R1-MVP-L1-HE2-R3-R1 scanner all-file scope + evidence truth closure: extension whitelist removed, git ls-files --cached --others --exclude-standard with os.walk fallback for non-git trees, ASCII bytes per-line matching (no errors=replace decode), fixed-dir/gitignore-only exclusions, N20/N21 validator-scope mutations with byte-identical restore",
  "approval_ref": "DC-12R1-MVP-L1-HE2-R3-R1",
  "date": "2026-08-25"
 },
 {
  "delta_id": "PD-2026-08-25-HE2-R3-R2-MUTATION-EOL-PORTABILITY",
  "kind": "governance",
  "affected_ids": [],
  "affected_paths": [
   "harness-governance/tests/"
  ],
  "base_sha": "68a68027e6b2d57ab35a77142b187c6301762de5",
  "owner": "cto",
  "reason": "DC-12R1-MVP-L1-HE2-R3-R2 mutation EOL portability closure: validator-mutation patches convert to the validator file's native checkout EOL (pure LF / pure CRLF; mixed EOL fails closed with a fixed category), unique-anchor enforcement, unconditional byte-exact restore with full SHA-256 + bytes comparison; dual-checkout gate proof (autocrlf=false and true)",
  "approval_ref": "DC-12R1-MVP-L1-HE2-R3-R2",
  "date": "2026-08-25"
 },
 {
  "delta_id": "PD-2026-08-28-HE2-ET1",
  "kind": "governance",
  "affected_ids": [],
  "affected_paths": [
   ".github/workflows/harness-governance-gate.yml",
   ".secrets.baseline",
   "harness-governance/governed-paths.json",
   "harness-governance/validator/",
   "harness-governance/schemas/",
   "harness-governance/inventory/execution-traps.json",
   "harness-governance/inventory/authority-profiles.json",
   "harness-governance/tests/"
  ],
  "base_sha": "246eb190fc07866f098a380e61ebdc5bd9428a04",
  "owner": "cto",
  "reason": "DC-12R1-MVP-L1-HE2-ET1 execution traps and authority runner: 15 machine-verifiable traps (schema/2 + additionalProperties=false, hardcoded evaluator whitelist, fail-closed token cardinality); authority profile references; fail-stop runner (in-process evaluators, nonce-bound proof binding); +20 unit tests, +14 RED mutations, +4 GREEN controls; structural/release split preserved (release=BLOCKED for open P0/P1 debt). Validator ET1 checker integrated with PROTECTED_PATHS gating governance-core changes through protocol-delta authorization.",
  "approval_ref": "DC-12R1-MVP-L1-HE2-ET1",
  "date": "2026-08-28"
 },
 {
  "delta_id": "PD-2026-08-28-HE2-ET1-R1",
  "kind": "governance",
  "affected_ids": [],
  "affected_paths": [
   "harness-governance/validator/",
   "harness-governance/tests/",
   "harness-governance/inventory/et1-node-manifest.txt",
   "harness-governance/inventory/authority-profiles.json",
   "harness-governance/README.md"
  ],
  "base_sha": "aaff330e395a1ae555672bd86f183d2fd89cae54",
  "date": "2026-08-28",
  "owner": "cto",
  "reason": "DC-12R1-MVP-L1-HE2-ET1-R1 end-to-end authority execution and child-process proof closure: runner v2 on the ET1 API with explicit ALLOWED_TRANSITIONS state machine (trap lands VOID, terminal states enforced), real argv --command via argparse REMAINDER launched exactly once (counter-guarded; non-zero exit = real test RED on FINISHED, never VOID), real pytest --collect-only child via the runner-owned plugin (child sessionstart re-verifies live PG role/URL/capability/nonce/bindings; collection_finish recomputes live HEAD + file-byte SHAs and writes real node IDs), cross-process nonce compare vs the runner-minted original (self-compare removed), candidate_sha=live rev-parse HEAD, profile/manifest sha256 over actual file bytes (frozen et1-node-manifest.txt), explicit-path schema-validated authority profile (hardcoded cli-mode rejected), live-git lineage, sanitized publish (presence/labels/counts only), +15 behavioral E2E mutations (X01-X15) with pristine/restore controls (66 RED / 9 GREEN total), 8-case E2E core-chain gate (GREEN sentinel==1; 7 RED sentinel==0); 116 unittest baseline preserved.",
  "approval_ref": "DC-12R1-MVP-L1-HE2-ET1-R1 task directive (BASE aaff330e395a1ae555672bd86f183d2fd89cae54; SOURCE_GATE_PASS_BUT_REMOTE_ENFORCEMENT_NOT_VERIFIED)"
 },
 {
  "delta_id": "PD-2026-08-28-HE2-ET1-R1-E1",
  "kind": "governance",
  "affected_ids": [],
  "affected_paths": [
   "harness-governance/inventory/protocol-deltas.json",
   "ai-ledger/product-ai/2026-08-28_dc12r1_mvp_l1_he2_et1_r1_e2e_authority_execution_closure.md"
  ],
  "base_sha": "18abc7a256f451ad7fa013e9d34c87e5442d852d",
  "date": "2026-08-28",
  "owner": "cto",
  "reason": "DC-12R1-MVP-L1-HE2-ET1-R1-E1 cross-task evidence reference and reviewer independence closure (PROVENANCE_CORRECTION_ONLY, V1_METADATA_AND_GOVERNANCE_STRUCTURE): the 26ed3fac KILO_STOP reference is marked INVALID_CROSS_TASK_REFERENCE (26ed3fac belongs to the H2-C browser harness Kilo STOP, not HE2-ET1; no citable prior HE2-ET1 Kilo review exists); PRIOR_HE2_ET1_KILO_REVIEW=NONE and NEXT_GATE=KILO_FINAL_CUMULATIVE_BOUNDED_REVIEW recorded; the R1 delta approval_ref now cites only the DC-12R1-MVP-L1-HE2-ET1-R1 task directive; functional bytes and verification conclusions of 18abc7a2 are unchanged and no functional gate was re-run or claim upgraded; author-owned gate container he2et1r1_pg16 removed (container + anonymous volumes; port 15445 freed) so any reviewer creates its own fresh throwaway PG.",
  "approval_ref": "DC-12R1-MVP-L1-HE2-ET1-R1-E1 task directive (BASE 18abc7a256f451ad7fa013e9d34c87e5442d852d; PROVENANCE_CORRECTION_ONLY)"
 },
 {
  "delta_id": "PD-2026-08-28-HE2-ET1-R2",
  "kind": "governance",
  "affected_ids": [],
  "affected_paths": [
   "harness-governance/validator/authority_runner.py",
   "harness-governance/validator/harness_governance_validator.py",
   "harness-governance/tests/pytest_et1_collector.py",
   "harness-governance/tests/test_authority_runner_r2.py",
   "harness-governance/tests/et1_r2_mutations.py",
   "harness-governance/tests/run_e2e_redis_cases.py",
   "harness-governance/tests/run_red_mutations.py",
   "harness-governance/inventory/execution-traps.json",
   "harness-governance/README.md"
  ],
  "base_sha": "2582750dedfb591e801703ff57bea69fbe91c605",
  "date": "2026-08-28",
  "owner": "cto",
  "reason": "DC-12R1-MVP-L1-HE2-ET1-R2 live Redis authority and child recheck closure (V3_GOVERNANCE_AUTHORITY_SECURITY, CANDIDATE_READY_FOR_KILO_REVIEW_ONLY): the Redis gate becomes a live stdlib-RESP probe on the URL's own host/port (connect; optional AUTH with credentials never in evidence/proofs/logs; PING==PONG; SELECT 15==OK; DBSIZE==0; sentinel 26379 unreachable; wrong-DB traps pre-connect) executed BOTH in runner preflight and in the child plugin's pytest_sessionstart, so Redis disappearing after preflight fails the child closed and the authority command is never launched; published artifacts carry fixed boolean categories only. TRAP_REDIS_WRONG_DB extended to evaluator EVAL_REDIS_LIVE (P1 ACTIVE exit 14, applies to runner.preflight + child.sessionstart) with live-probe required evidence; EVAL_REDIS_LIVE whitelisted in the runner and the mirrored validator whitelist (validator change is the single whitelist line; schema unchanged because the extension stays within the existing draft-07 contract). +15 unit tests over a threaded real-socket fake RESP server incl. credential-redaction proofs; +5 RED mutations R201-R205 (connect deleted, PING skipped, DBSIZE skipped, connection errors swallowed, child recheck deleted) with pristine + byte-exact-restore controls, total gate 71 RED / 9 GREEN; live E2E run_e2e_redis_cases.py 6/6 on fresh throwaway redis7 (GREEN fresh DB15, wrong db, unreachable, DB15 non-empty, post-preflight disappearance child-fail-closed sentinel 0, sentinel-26379-reachable) plus the 8-case core chain green on fresh PG16+redis7; PRIOR_M0 report tip 58b8e2ac marked SUPERSEDED_BY_HE2_ET1_R2_REDIS_AUTHORITY_DEFECT.",